{
  "$schema": "https://github.com/x-salmon/shellby/blob/main/docs/addon.schema.json",
  "format": 1,
  "id": "tide-pool",
  "name": "Tide Pool",
  "author": "x-salmon",
  "version": "1.0.0",
  "description": "Where a hermit crab actually comes from. A starfish, a dive mask, puka shells, kelp, barnacles and an inner tube, with bubbles and plankton.",
  "homepage": "https://github.com/x-salmon/shellby",
  "accessories": [
    {
      "id": "starfish",
      "name": "Starfish",
      "description": "Petted twenty-five times. A friend climbed aboard.",
      "slot": "hat",
      "rarity": "rare",
      "pivot": [2, 3],
      "palette": { "o": "#ff8c42", "O": "#d96c00", "w": "#fff4e4" },
      "pixels": [
        "..o..",
        ".oOo.",
        "oOwOo",
        ".o.o."
      ],
      "unlock": { "achievement": "good-crab" }
    },
    {
      "id": "dive-mask",
      "name": "Dive Mask",
      "description": "Going down to have a look at the logs.",
      "slot": "face",
      "rarity": "rare",
      "pivot": [4, 0],
      "palette": { "k": "#1b1b1f", "c": "#a8ecd9", "b": "#ff8c42" },
      "pixels": [
        "bkkkkkkkb",
        "bkccccckb",
        ".kkkkkkk."
      ]
    },
    {
      "id": "puka-shells",
      "name": "Puka Shells",
      "description": "Collected one at a time, over a long summer.",
      "slot": "neck",
      "pivot": [3, 0],
      "palette": { "w": "#fff4e4", "c": "#e0cdb4", "p": "#ff8fab" },
      "pixels": [
        "pcwcpcwc",
        "..cpc..."
      ]
    },
    {
      "id": "kelp-frond",
      "name": "Kelp Frond",
      "description": "Dinner, or a flag. Depends on the mood.",
      "slot": "held",
      "pivot": [1, 6],
      "palette": { "G": "#52b788", "g": "#2d6a4f" },
      "pixels": [
        ".G.",
        "GG.",
        ".GG",
        "GG.",
        ".G.",
        ".g."
      ]
    },
    {
      "id": "barnacles",
      "name": "Barnacles",
      "description": "Seven days together. They are tenants now.",
      "slot": "shell",
      "pivot": [2, 3],
      "palette": { "w": "#f1e3d3", "W": "#cfc0a8" },
      "pixels": [
        ".w.w.",
        "wWwWw",
        ".W.W."
      ],
      "unlock": { "achievement": "loyal" }
    },
    {
      "id": "inner-tube",
      "name": "Inner Tube",
      "description": "Thrown across the screen. Safety first, next time.",
      "slot": "shell",
      "rarity": "rare",
      "pivot": [3, 2],
      "palette": { "R": "#e63946", "w": "#f8f9fa" },
      "pixels": [
        ".RwRwR.",
        "R.....R",
        "R.....R",
        ".RwRwR."
      ],
      "unlock": { "achievement": "frequent-flyer" }
    }
  ],
  "effects": [
    {
      "id": "bubbles",
      "name": "Bubbles",
      "description": "Somewhere down there, he is still breathing.",
      "motion": "rise",
      "count": 10,
      "speed": 0.9,
      "sprites": [
        {
          "palette": { "b": "#a8ecd9" },
          "pixels": [
            ".b.",
            "b.b",
            ".b."
          ]
        },
        {
          "palette": { "b": "#a8ecd9" },
          "pixels": [
            "b"
          ]
        },
        {
          "palette": { "b": "#3fb8a3" },
          "pixels": [
            "bb",
            "bb"
          ]
        }
      ]
    },
    {
      "id": "plankton",
      "name": "Plankton",
      "description": "The water is never really empty.",
      "motion": "float",
      "count": 14,
      "speed": 0.5,
      "sprites": [
        {
          "palette": { "p": "#b7e4c7" },
          "pixels": [
            "p"
          ]
        },
        {
          "palette": { "p": "#a8ecd9" },
          "pixels": [
            ".p",
            "p."
          ]
        }
      ]
    }
  ]
}
